{
  "taskId": "RD-136",
  "domain": "AWS",
  "category": "AWS",
  "title": "S3 Storage & Cost Report",
  "description": "Reports each bucket's size by storage class from CloudWatch metrics, with an approximate monthly cost for ranking. Read-only, and it does not list objects.",
  "runtime": "python",
  "inputs": [
    {
      "variable": "Region",
      "label": "AWS region",
      "type": "string",
      "required": true,
      "pattern": "^[a-z]{2}(-gov)?-[a-z]+-[0-9]$",
      "default": "us-east-1",
      "placeholder": "us-east-1",
      "help": "EC2 resources are per-region. Cost Explorer is global but only answers in us-east-1."
    }
  ],
  "nodes": [
    {
      "type": "pyscript",
      "label": "Size every bucket from CloudWatch",
      "value": "import json\nfrom datetime import datetime, timedelta, timezone\nimport boto3\nfrom botocore.exceptions import ClientError\n\n# A step with no cloud integration bound reaches signing time and raises\n# NoCredentialsError as a bare traceback. The agent would then file that\n# traceback as an observation. Fail here instead, with a sentence that names\n# what is missing and who fixes it.\n_creds = boto3.session.Session().get_credentials()\nif _creds is None:\n    print(json.dumps({\"error\": \"No AWS credentials reached this step. Bind an AWS cloud \"\n                               \"integration to this automation under Cloud Integrations, \"\n                               \"and make sure it is available to this project.\"}))\n    raise SystemExit(1)\n\nREGION = \"{{Region}}\"\nsession = boto3.session.Session(region_name=REGION)\ns3 = session.client(\"s3\")\ncw = session.client(\"cloudwatch\")\n\n# S3 has no \"size of bucket\" API. CloudWatch publishes daily storage metrics\n# instead, which is why this reads metrics rather than listing objects \u2014 a\n# listing walk over a large bucket would take hours and cost money itself.\nSTORAGE_TYPES = [\n    \"StandardStorage\", \"StandardIAStorage\", \"OneZoneIAStorage\",\n    \"GlacierInstantRetrievalStorage\", \"IntelligentTieringFAStorage\",\n]\nend = datetime.now(timezone.utc)\nstart = end - timedelta(days=3)\n\nout = {\"region\": REGION, \"buckets\": [], \"errors\": [],\n       \"note\": \"Sizes come from CloudWatch daily storage metrics and lag by up to 48 hours.\"}\n\ntry:\n    buckets = s3.list_buckets().get(\"Buckets\", [])\nexcept ClientError as e:\n    print(json.dumps({\"error\": \"could not list buckets: \" + str(e)}))\n    raise SystemExit(1)\n\nfor b in buckets:\n    name = b[\"Name\"]\n    entry = {\"name\": name, \"bytesByClass\": {}, \"totalBytes\": 0, \"objects\": None}\n    for storage in STORAGE_TYPES:\n        try:\n            points = cw.get_metric_statistics(\n                Namespace=\"AWS/S3\", MetricName=\"BucketSizeBytes\",\n                Dimensions=[{\"Name\": \"BucketName\", \"Value\": name},\n                            {\"Name\": \"StorageType\", \"Value\": storage}],\n                StartTime=start, EndTime=end, Period=86400, Statistics=[\"Average\"],\n            ).get(\"Datapoints\", [])\n            if points:\n                value = sorted(points, key=lambda p: p[\"Timestamp\"])[-1][\"Average\"]\n                entry[\"bytesByClass\"][storage] = int(value)\n                entry[\"totalBytes\"] += int(value)\n        except ClientError as e:\n            out[\"errors\"].append({\"bucket\": name, \"metric\": storage,\n                                  \"error\": e.response[\"Error\"][\"Code\"]})\n    try:\n        points = cw.get_metric_statistics(\n            Namespace=\"AWS/S3\", MetricName=\"NumberOfObjects\",\n            Dimensions=[{\"Name\": \"BucketName\", \"Value\": name},\n                        {\"Name\": \"StorageType\", \"Value\": \"AllStorageTypes\"}],\n            StartTime=start, EndTime=end, Period=86400, Statistics=[\"Average\"],\n        ).get(\"Datapoints\", [])\n        if points:\n            entry[\"objects\"] = int(sorted(points, key=lambda p: p[\"Timestamp\"])[-1][\"Average\"])\n    except ClientError:\n        pass\n\n    entry[\"totalGiB\"] = round(entry[\"totalBytes\"] / (1024 ** 3), 2)\n    # Standard storage list price; other classes cost less. Ranking, not billing.\n    entry[\"approxMonthlyUsd\"] = round(entry[\"totalGiB\"] * 0.023, 2)\n    out[\"buckets\"].append(entry)\n\nout[\"buckets\"].sort(key=lambda x: x[\"totalBytes\"], reverse=True)\nout[\"summary\"] = {\n    \"buckets\": len(out[\"buckets\"]),\n    \"totalGiB\": round(sum(x[\"totalGiB\"] for x in out[\"buckets\"]), 2),\n    \"approxMonthlyUsd\": round(sum(x[\"approxMonthlyUsd\"] for x in out[\"buckets\"]), 2),\n    \"bucketsWithNoMetrics\": sum(1 for x in out[\"buckets\"] if x[\"totalBytes\"] == 0),\n}\nprint(json.dumps(out, indent=2))"
    }
  ],
  "requires": [
    {
      "kind": "cloud_connection",
      "platform": "AWS",
      "customerText": "An AWS cloud integration available to this project, with read-only permission for: s3:ListAllMyBuckets, cloudwatch:GetMetricStatistics"
    },
    {
      "kind": "runtime",
      "runtime": "python",
      "customerText": "The job runner executes Python steps; boto3 ships in the image."
    }
  ]
}
