{
  "taskId": "RD-141",
  "domain": "AWS",
  "category": "AWS",
  "title": "Cost Anomaly Report",
  "description": "Compares unblended spend per service across two equal windows and reports what moved, in dollars and percent. Read-only.",
  "runtime": "python",
  "inputs": [
    {
      "variable": "LookbackDays",
      "label": "Look-back window (days)",
      "type": "number",
      "required": true,
      "min": 7,
      "max": 180,
      "default": 30,
      "consumedBy": "agent",
      "help": "How far back to compare spend. Shorter windows react faster and cry wolf more."
    }
  ],
  "nodes": [
    {
      "type": "pyscript",
      "label": "Compare spend by service",
      "value": "import json\nfrom datetime import date, timedelta\nimport boto3\nfrom botocore.exceptions import ClientError\n\n# A step with no cloud integration bound reaches signing time and raises\n# NoCredentialsError as a bare traceback. The agent would then file that\n# traceback as an observation. Fail here instead, with a sentence that names\n# what is missing and who fixes it.\n_creds = boto3.session.Session().get_credentials()\nif _creds is None:\n    print(json.dumps({\"error\": \"No AWS credentials reached this step. Bind an AWS cloud \"\n                               \"integration to this automation under Cloud Integrations, \"\n                               \"and make sure it is available to this project.\"}))\n    raise SystemExit(1)\n\nDAYS = int(\"{{LookbackDays}}\")\n\n# Cost Explorer is a global service with a single endpoint in us-east-1. Calling\n# it in the run's own region returns an endpoint error that reads like a\n# permissions problem, so the region is pinned here rather than taken as input.\nce = boto3.session.Session(region_name=\"us-east-1\").client(\"ce\")\n\nend = date.today()\nstart = end - timedelta(days=DAYS * 2)          # two windows: previous vs recent\nmid = end - timedelta(days=DAYS)\n\nout = {\"lookbackDays\": DAYS,\n       \"window\": {\"previous\": [start.isoformat(), mid.isoformat()],\n                  \"recent\": [mid.isoformat(), end.isoformat()]},\n       \"services\": [], \"errors\": []}\n\n\ndef by_service(a, b):\n    res = ce.get_cost_and_usage(\n        TimePeriod={\"Start\": a.isoformat(), \"End\": b.isoformat()},\n        Granularity=\"MONTHLY\",\n        Metrics=[\"UnblendedCost\"],\n        GroupBy=[{\"Type\": \"DIMENSION\", \"Key\": \"SERVICE\"}],\n    )\n    totals = {}\n    for period in res.get(\"ResultsByTime\", []):\n        for group in period.get(\"Groups\", []):\n            name = group[\"Keys\"][0]\n            amount = float(group[\"Metrics\"][\"UnblendedCost\"][\"Amount\"])\n            totals[name] = totals.get(name, 0.0) + amount\n    return totals\n\n\ntry:\n    previous = by_service(start, mid)\n    recent = by_service(mid, end)\nexcept ClientError as e:\n    print(json.dumps({\"error\": \"Cost Explorer unavailable: \"\n                               + e.response[\"Error\"][\"Code\"]}))\n    raise SystemExit(1)\n\nfor service in sorted(set(previous) | set(recent)):\n    was = round(previous.get(service, 0.0), 2)\n    now = round(recent.get(service, 0.0), 2)\n    delta = round(now - was, 2)\n    # A service that appeared this window has no baseline to divide by; saying\n    # \"new\" is honest where a percentage would be infinite or misleading.\n    if was == 0:\n        pct = None\n    else:\n        pct = round((delta / was) * 100.0, 1)\n    if abs(delta) < 0.01:\n        continue\n    out[\"services\"].append({\n        \"service\": service, \"previousUsd\": was, \"recentUsd\": now,\n        \"deltaUsd\": delta, \"deltaPct\": pct, \"isNew\": was == 0 and now > 0,\n    })\n\nout[\"services\"].sort(key=lambda row: row[\"deltaUsd\"], reverse=True)\nout[\"summary\"] = {\n    \"previousTotalUsd\": round(sum(previous.values()), 2),\n    \"recentTotalUsd\": round(sum(recent.values()), 2),\n    \"deltaUsd\": round(sum(recent.values()) - sum(previous.values()), 2),\n    \"servicesUp\": sum(1 for r in out[\"services\"] if r[\"deltaUsd\"] > 0),\n}\nprint(json.dumps(out, indent=2))"
    }
  ],
  "requires": [
    {
      "kind": "cloud_connection",
      "platform": "AWS",
      "customerText": "An AWS cloud integration available to this project, with read-only permission for: ce:GetCostAndUsage"
    },
    {
      "kind": "runtime",
      "runtime": "python",
      "customerText": "The job runner executes Python steps; boto3 ships in the image."
    }
  ]
}
