{
  "taskId": "RD-145",
  "domain": "AWS",
  "category": "AWS",
  "title": "IAM Access Key Audit",
  "description": "Reports every IAM user access key with its age, when it was last used, and whether it has ever been used at all. Read-only: it disables nothing.",
  "runtime": "python",
  "inputs": [
    {
      "variable": "Region",
      "label": "AWS region",
      "type": "string",
      "required": true,
      "pattern": "^[a-z]{2}(-gov)?-[a-z]+-[0-9]$",
      "default": "us-east-1",
      "placeholder": "us-east-1",
      "help": "One region per run. Bucket and IAM listings are account-wide; EC2 resources are per-region."
    },
    {
      "variable": "MaxKeyAgeDays",
      "label": "Key age threshold (days)",
      "type": "number",
      "required": true,
      "min": 1,
      "max": 3650,
      "default": 90,
      "consumedBy": "agent",
      "help": "Keys older than this are flagged. Rotation policies are commonly 90 days."
    }
  ],
  "nodes": [
    {
      "type": "pyscript",
      "label": "Audit IAM access keys",
      "value": "import json\nfrom datetime import datetime, timezone\nimport boto3\nfrom botocore.exceptions import ClientError\n\n# A step with no cloud integration bound reaches signing time and raises\n# NoCredentialsError as a bare traceback. The agent would then file that\n# traceback as an observation. Fail here instead, with a sentence that names\n# what is missing and who fixes it.\n_creds = boto3.session.Session().get_credentials()\nif _creds is None:\n    print(json.dumps({\"error\": \"No AWS credentials reached this step. Bind an AWS cloud \"\n                               \"integration to this automation under Cloud Integrations, \"\n                               \"and make sure it is available to this project.\"}))\n    raise SystemExit(1)\n\nMAX_AGE = int(\"{{MaxKeyAgeDays}}\")\niam = boto3.session.Session(region_name=\"{{Region}}\").client(\"iam\")\nnow = datetime.now(timezone.utc)\n\n\ndef age_days(ts):\n    return (now - ts).days if ts else None\n\n\nout = {\"maxKeyAgeDays\": MAX_AGE, \"users\": [], \"errors\": []}\n\nfor page in iam.get_paginator(\"list_users\").paginate():\n    for user in page[\"Users\"]:\n        name = user[\"UserName\"]\n        entry = {\"user\": name, \"keys\": []}\n        try:\n            for key in iam.list_access_keys(UserName=name)[\"AccessKeyMetadata\"]:\n                key_id = key[\"AccessKeyId\"]\n                # LastUsedDate is ABSENT when a key has never been used, which\n                # is a different finding from \"used, but a long time ago\".\n                used = iam.get_access_key_last_used(AccessKeyId=key_id) \\\n                          .get(\"AccessKeyLastUsed\", {})\n                last = used.get(\"LastUsedDate\")\n                created = age_days(key[\"CreateDate\"])\n                entry[\"keys\"].append({\n                    \"keyId\": key_id,\n                    \"status\": key[\"Status\"],\n                    \"ageDays\": created,\n                    \"lastUsedDays\": age_days(last),\n                    \"neverUsed\": last is None,\n                    \"lastService\": used.get(\"ServiceName\"),\n                    \"overAge\": (created or 0) > MAX_AGE,\n                })\n        except ClientError as e:\n            out[\"errors\"].append({\"user\": name, \"error\": e.response[\"Error\"][\"Code\"]})\n            continue\n        if entry[\"keys\"]:\n            out[\"users\"].append(entry)\n\nkeys = [k for u in out[\"users\"] for k in u[\"keys\"]]\nout[\"summary\"] = {\n    \"users\": len(out[\"users\"]),\n    \"keys\": len(keys),\n    \"activeOverAge\": sum(1 for k in keys if k[\"overAge\"] and k[\"status\"] == \"Active\"),\n    \"activeNeverUsed\": sum(1 for k in keys if k[\"neverUsed\"] and k[\"status\"] == \"Active\"),\n}\nprint(json.dumps(out, indent=2))"
    }
  ],
  "requires": [
    {
      "kind": "cloud_connection",
      "platform": "AWS",
      "customerText": "An AWS cloud integration available to this project, with read-only permission for: iam:ListUsers, iam:ListAccessKeys, iam:GetAccessKeyLastUsed"
    },
    {
      "kind": "runtime",
      "runtime": "python",
      "customerText": "The job runner executes Python steps; boto3 ships in the image."
    }
  ]
}
