{
  "taskId": "RD-142",
  "domain": "AWS",
  "category": "AWS",
  "title": "Idle Resource Report",
  "description": "Reports unattached EBS volumes and unassociated Elastic IPs with an approximate monthly cost, for ranking cleanup candidates. Read-only: it is the reporting counterpart to the cleanup automation and deletes nothing.",
  "runtime": "python",
  "inputs": [
    {
      "variable": "Region",
      "label": "AWS region",
      "type": "string",
      "required": true,
      "pattern": "^[a-z]{2}(-gov)?-[a-z]+-[0-9]$",
      "default": "us-east-1",
      "placeholder": "us-east-1",
      "help": "EC2 resources are per-region. Cost Explorer is global but only answers in us-east-1."
    },
    {
      "variable": "MinIdleDays",
      "label": "Minimum age (days)",
      "type": "number",
      "required": true,
      "min": 0,
      "max": 3650,
      "default": 30,
      "consumedBy": "agent",
      "help": "Volumes newer than this are ignored \u2014 a disk detached yesterday is often mid-migration, not waste."
    }
  ],
  "nodes": [
    {
      "type": "pyscript",
      "label": "List idle volumes and addresses",
      "value": "import json\nfrom datetime import datetime, timezone\nimport boto3\nfrom botocore.exceptions import ClientError\n\n# A step with no cloud integration bound reaches signing time and raises\n# NoCredentialsError as a bare traceback. The agent would then file that\n# traceback as an observation. Fail here instead, with a sentence that names\n# what is missing and who fixes it.\n_creds = boto3.session.Session().get_credentials()\nif _creds is None:\n    print(json.dumps({\"error\": \"No AWS credentials reached this step. Bind an AWS cloud \"\n                               \"integration to this automation under Cloud Integrations, \"\n                               \"and make sure it is available to this project.\"}))\n    raise SystemExit(1)\n\nREGION = \"{{Region}}\"\nMIN_AGE = int(\"{{MinIdleDays}}\")\nec2 = boto3.session.Session(region_name=REGION).client(\"ec2\")\nnow = datetime.now(timezone.utc)\n\n# Published on-demand rates vary by region and change over time. These are\n# approximations for RANKING candidates, and the report says so \u2014 quoting them\n# as a bill would be inventing a number the API never returned.\nGB_MONTH_USD = {\"gp3\": 0.08, \"gp2\": 0.10, \"io1\": 0.125, \"io2\": 0.125,\n                \"st1\": 0.045, \"sc1\": 0.015, \"standard\": 0.05}\nEIP_MONTH_USD = 3.60\n\nout = {\"region\": REGION, \"minIdleDays\": MIN_AGE,\n       \"costBasis\": \"approximate published on-demand rates, for ranking only\",\n       \"volumes\": [], \"addresses\": [], \"errors\": []}\n\ntry:\n    for page in ec2.get_paginator(\"describe_volumes\").paginate(\n            Filters=[{\"Name\": \"status\", \"Values\": [\"available\"]}]):\n        for vol in page[\"Volumes\"]:\n            idle_days = (now - vol[\"CreateTime\"]).days\n            if idle_days < MIN_AGE:\n                continue\n            vtype = vol.get(\"VolumeType\", \"gp2\")\n            size = vol.get(\"Size\", 0)\n            tags = {t[\"Key\"]: t[\"Value\"] for t in vol.get(\"Tags\", [])}\n            out[\"volumes\"].append({\n                \"volumeId\": vol[\"VolumeId\"],\n                \"sizeGiB\": size,\n                \"type\": vtype,\n                \"availabilityZone\": vol.get(\"AvailabilityZone\"),\n                \"encrypted\": vol.get(\"Encrypted\"),\n                \"createdDaysAgo\": idle_days,\n                \"approxMonthlyUsd\": round(size * GB_MONTH_USD.get(vtype, 0.10), 2),\n                \"tags\": tags,\n            })\nexcept ClientError as e:\n    out[\"errors\"].append({\"step\": \"describe_volumes\", \"error\": e.response[\"Error\"][\"Code\"]})\n\ntry:\n    for addr in ec2.describe_addresses().get(\"Addresses\", []):\n        # An EIP bills only while it is NOT associated with a running instance.\n        if addr.get(\"AssociationId\"):\n            continue\n        out[\"addresses\"].append({\n            \"publicIp\": addr.get(\"PublicIp\"),\n            \"allocationId\": addr.get(\"AllocationId\"),\n            \"domain\": addr.get(\"Domain\"),\n            \"approxMonthlyUsd\": EIP_MONTH_USD,\n            \"tags\": {t[\"Key\"]: t[\"Value\"] for t in addr.get(\"Tags\", [])},\n        })\nexcept ClientError as e:\n    out[\"errors\"].append({\"step\": \"describe_addresses\", \"error\": e.response[\"Error\"][\"Code\"]})\n\nout[\"volumes\"].sort(key=lambda v: v[\"approxMonthlyUsd\"], reverse=True)\nout[\"summary\"] = {\n    \"unattachedVolumes\": len(out[\"volumes\"]),\n    \"unassociatedAddresses\": len(out[\"addresses\"]),\n    \"approxMonthlyUsd\": round(\n        sum(v[\"approxMonthlyUsd\"] for v in out[\"volumes\"])\n        + sum(a[\"approxMonthlyUsd\"] for a in out[\"addresses\"]), 2),\n}\nprint(json.dumps(out, indent=2))"
    }
  ],
  "requires": [
    {
      "kind": "cloud_connection",
      "platform": "AWS",
      "customerText": "An AWS cloud integration available to this project, with read-only permission for: ec2:DescribeVolumes, ec2:DescribeAddresses"
    },
    {
      "kind": "runtime",
      "runtime": "python",
      "customerText": "The job runner executes Python steps; boto3 ships in the image."
    }
  ]
}
